{
    "participant_id": {
        "LongName": "Participant Identifier",
        "Description": "Unique BIDS identifier for the participant in this study."
    },
    "subjectkey": {
        "Description": "The NDAR Global Unique Identifier (GUID) for research subject",
        "DataType": "GUID",
        "ValueRange": "NDAR*"
    },
    "src_subject_id": {
        "Description": "Subject ID how it's defined in lab/project",
        "DataType": "String"
    },
    "interview_date": {
        "Description": "Date on which the interview/genetic test/sampling/imaging/biospecimen was completed. MM/DD/YYYY",
        "DataType": "Date"
    },
    "interview_age": {
        "Description": "Age in months at the time of the interview/test/sampling/imaging. | Age is rounded to chronological month. If the research participant is 15-days-old at time of interview, the appropriate value would be 0 months. If the participant is 16-days-old, the value would be 1 month.",
        "DataType": "Integer",
        "ValueRange": "0 :: 1260"
    },
    "sex": {
        "Description": "Sex of subject at birth | M = Male; F = Female; O=Other; NR = Not reported",
        "DataType": "String",
        "ValueRange": "M;F; O; NR",
        "Levels": {
            "M": "Male",
            "F": "Female",
            "O": "Other",
            "NR": "Not reported"
        }
    },
    "meim_select_language___1": {
        "Description": "\u00bfEspa\u00f1ol? (1, S\u00ed) | 0 = No; 1 = Yes",
        "DataType": "Integer",
        "ValueRange": "0 ; 1",
        "Levels": {
            "0": "No",
            "1": "Yes"
        }
    },
    "meim_1_p": {
        "Description": "I have spent time trying to find out more about my ethnic group, such as its history, traditions, and customs. He pasado tiempo intentando saber m\u00e1s sobre mi grupo \u00e9tnico, como su historia, tradiciones y costumbres. | 1 = Strongly Agree Estoy totalmente de acuerdo; 2 = Agree Estoy  de acuerdo; 3 = Neutral Ni uno ni lo otro; 4 = Disagree No estoy de acuerdo; 5 = Strongly Disagree No estoy totalmente de acuerdo; In this country, people come from many different countries and cultures, and there are many different words to describe the different backgrounds or ethnic groups that people come from. Some examples of the names of ethnic groups are Hispanic or Latino, Black or African American, Asian American, Chinese, Filipino, American Indian, Mexican American, Caucasian or White, Italian American, and many others. These questions are about your ethnicity or your ethnic group and how you feel about it or react to it. En Estados Unidos, la gente viene de muchos pa\u00c3\u00adses y culturas diferentes y existen muchas palabras diferentes para describir los distintos or\u00c3\u00adgenes o grupos \u00c3\u00a9tnicos de los que vienen las personas. Algunos ejemplos de nombres de grupos \u00c3\u00a9tnicos son hispano o latino, negro o africano americano, asi\u00c3\u00a1tico americano, chino, filipino, indio americano, mexicano americano, c\u00c3\u00a1sico o blanco, italiano americano, y muchos otros. Estas preguntas se relacionan con su etnia o su grupo \u00c3\u00a9tnico y con la forma en que usted se siente o reacciona a ello.",
        "DataType": "Integer",
        "ValueRange": "1 ; 2 ; 3 ; 4 ; 5",
        "Levels": {
            "1": "Strongly Agree Estoy totalmente de acuerdo",
            "2": "Agree Estoy  de acuerdo",
            "3": "Neutral Ni uno ni lo otro",
            "4": "Disagree No estoy de acuerdo",
            "5": "Strongly Disagree No estoy totalmente de acuerdo"
        }
    },
    "meim_2_p": {
        "Description": "I have a strong sense of belonging to my own ethnic group. Tengo un fuerte sentido de pertenecer con mi propio grupo \u00e9tnico. | 1 = Strongly Agree Estoy totalmente de acuerdo; 2 = Agree Estoy  de acuerdo; 3 = Neutral Ni uno ni lo otro; 4 = Disagree No estoy de acuerdo; 5 = Strongly Disagree No estoy totalmente de acuerdo; In this country, people come from many different countries and cultures, and there are many different words to describe the different backgrounds or ethnic groups that people come from. Some examples of the names of ethnic groups are Hispanic or Latino, Black or African American, Asian American, Chinese, Filipino, American Indian, Mexican American, Caucasian or White, Italian American, and many others. These questions are about your ethnicity or your ethnic group and how you feel about it or react to it. En Estados Unidos, la gente viene de muchos pa\u00c3\u00adses y culturas diferentes y existen muchas palabras diferentes para describir los distintos or\u00c3\u00adgenes o grupos \u00c3\u00a9tnicos de los que vienen las personas. Algunos ejemplos de nombres de grupos \u00c3\u00a9tnicos son hispano o latino, negro o africano americano, asi\u00c3\u00a1tico americano, chino, filipino, indio americano, mexicano americano, c\u00c3\u00a1sico o blanco, italiano americano, y muchos otros. Estas preguntas se relacionan con su etnia o su grupo \u00c3\u00a9tnico y con la forma en que usted se siente o reacciona a ello.",
        "DataType": "Integer",
        "ValueRange": "1 ; 2 ; 3 ; 4 ; 5",
        "Levels": {
            "1": "Strongly Agree Estoy totalmente de acuerdo",
            "2": "Agree Estoy  de acuerdo",
            "3": "Neutral Ni uno ni lo otro",
            "4": "Disagree No estoy de acuerdo",
            "5": "Strongly Disagree No estoy totalmente de acuerdo"
        }
    },
    "meim_3_p": {
        "Description": "I understand pretty well what my ethnic group membership means to me. Entiendo bastante bien lo que significa para m\u00ed pertenecer a mi grupo \u00e9tnico. | 1 = Strongly Agree Estoy totalmente de acuerdo; 2 = Agree Estoy  de acuerdo; 3 = Neutral Ni uno ni lo otro; 4 = Disagree No estoy de acuerdo; 5 = Strongly Disagree No estoy totalmente de acuerdo; In this country, people come from many different countries and cultures, and there are many different words to describe the different backgrounds or ethnic groups that people come from. Some examples of the names of ethnic groups are Hispanic or Latino, Black or African American, Asian American, Chinese, Filipino, American Indian, Mexican American, Caucasian or White, Italian American, and many others. These questions are about your ethnicity or your ethnic group and how you feel about it or react to it. En Estados Unidos, la gente viene de muchos pa\u00c3\u00adses y culturas diferentes y existen muchas palabras diferentes para describir los distintos or\u00c3\u00adgenes o grupos \u00c3\u00a9tnicos de los que vienen las personas. Algunos ejemplos de nombres de grupos \u00c3\u00a9tnicos son hispano o latino, negro o africano americano, asi\u00c3\u00a1tico americano, chino, filipino, indio americano, mexicano americano, c\u00c3\u00a1sico o blanco, italiano americano, y muchos otros. Estas preguntas se relacionan con su etnia o su grupo \u00c3\u00a9tnico y con la forma en que usted se siente o reacciona a ello.",
        "DataType": "Integer",
        "ValueRange": "1 ; 2 ; 3 ; 4 ; 5",
        "Levels": {
            "1": "Strongly Agree Estoy totalmente de acuerdo",
            "2": "Agree Estoy  de acuerdo",
            "3": "Neutral Ni uno ni lo otro",
            "4": "Disagree No estoy de acuerdo",
            "5": "Strongly Disagree No estoy totalmente de acuerdo"
        }
    },
    "meim_4_p": {
        "Description": "I have often done things that will help me understand my ethnic background better. Muchas veces he hecho cosas que me ayudar\u00e1n a comprender mejor a mi grupo \u00e9tnico. | 1 = Strongly Agree Estoy totalmente de acuerdo; 2 = Agree Estoy  de acuerdo; 3 = Neutral Ni uno ni lo otro; 4 = Disagree No estoy de acuerdo; 5 = Strongly Disagree No estoy totalmente de acuerdo; In this country, people come from many different countries and cultures, and there are many different words to describe the different backgrounds or ethnic groups that people come from. Some examples of the names of ethnic groups are Hispanic or Latino, Black or African American, Asian American, Chinese, Filipino, American Indian, Mexican American, Caucasian or White, Italian American, and many others. These questions are about your ethnicity or your ethnic group and how you feel about it or react to it. En Estados Unidos, la gente viene de muchos pa\u00c3\u00adses y culturas diferentes y existen muchas palabras diferentes para describir los distintos or\u00c3\u00adgenes o grupos \u00c3\u00a9tnicos de los que vienen las personas. Algunos ejemplos de nombres de grupos \u00c3\u00a9tnicos son hispano o latino, negro o africano americano, asi\u00c3\u00a1tico americano, chino, filipino, indio americano, mexicano americano, c\u00c3\u00a1sico o blanco, italiano americano, y muchos otros. Estas preguntas se relacionan con su etnia o su grupo \u00c3\u00a9tnico y con la forma en que usted se siente o reacciona a ello.",
        "DataType": "Integer",
        "ValueRange": "1 ; 2 ; 3 ; 4 ; 5",
        "Levels": {
            "1": "Strongly Agree Estoy totalmente de acuerdo",
            "2": "Agree Estoy  de acuerdo",
            "3": "Neutral Ni uno ni lo otro",
            "4": "Disagree No estoy de acuerdo",
            "5": "Strongly Disagree No estoy totalmente de acuerdo"
        }
    },
    "meim_5_p": {
        "Description": "I have often talked to other people in order to learn more about my ethnic group. Con frecuencia he hablado con otras personas para aprender m\u00e1s sobre mi grupo \u00e9tnico. | 1 = Strongly Agree Estoy totalmente de acuerdo; 2 = Agree Estoy  de acuerdo; 3 = Neutral Ni uno ni lo otro; 4 = Disagree No estoy de acuerdo; 5 = Strongly Disagree No estoy totalmente de acuerdo; In this country, people come from many different countries and cultures, and there are many different words to describe the different backgrounds or ethnic groups that people come from. Some examples of the names of ethnic groups are Hispanic or Latino, Black or African American, Asian American, Chinese, Filipino, American Indian, Mexican American, Caucasian or White, Italian American, and many others. These questions are about your ethnicity or your ethnic group and how you feel about it or react to it. En Estados Unidos, la gente viene de muchos pa\u00c3\u00adses y culturas diferentes y existen muchas palabras diferentes para describir los distintos or\u00c3\u00adgenes o grupos \u00c3\u00a9tnicos de los que vienen las personas. Algunos ejemplos de nombres de grupos \u00c3\u00a9tnicos son hispano o latino, negro o africano americano, asi\u00c3\u00a1tico americano, chino, filipino, indio americano, mexicano americano, c\u00c3\u00a1sico o blanco, italiano americano, y muchos otros. Estas preguntas se relacionan con su etnia o su grupo \u00c3\u00a9tnico y con la forma en que usted se siente o reacciona a ello.",
        "DataType": "Integer",
        "ValueRange": "1 ; 2 ; 3 ; 4 ; 5",
        "Levels": {
            "1": "Strongly Agree Estoy totalmente de acuerdo",
            "2": "Agree Estoy  de acuerdo",
            "3": "Neutral Ni uno ni lo otro",
            "4": "Disagree No estoy de acuerdo",
            "5": "Strongly Disagree No estoy totalmente de acuerdo"
        }
    },
    "meim_6_p": {
        "Description": "I feel a strong attachment towards my own ethnic group. Siento una fuerte conexi\u00f3n hacia mi propio grupo \u00e9tnico. | 1 = Strongly Agree Estoy totalmente de acuerdo; 2 = Agree Estoy  de acuerdo; 3 = Neutral Ni uno ni lo otro; 4 = Disagree No estoy de acuerdo; 5 = Strongly Disagree No estoy totalmente de acuerdo; In this country, people come from many different countries and cultures, and there are many different words to describe the different backgrounds or ethnic groups that people come from. Some examples of the names of ethnic groups are Hispanic or Latino, Black or African American, Asian American, Chinese, Filipino, American Indian, Mexican American, Caucasian or White, Italian American, and many others. These questions are about your ethnicity or your ethnic group and how you feel about it or react to it. En Estados Unidos, la gente viene de muchos pa\u00c3\u00adses y culturas diferentes y existen muchas palabras diferentes para describir los distintos or\u00c3\u00adgenes o grupos \u00c3\u00a9tnicos de los que vienen las personas. Algunos ejemplos de nombres de grupos \u00c3\u00a9tnicos son hispano o latino, negro o africano americano, asi\u00c3\u00a1tico americano, chino, filipino, indio americano, mexicano americano, c\u00c3\u00a1sico o blanco, italiano americano, y muchos otros. Estas preguntas se relacionan con su etnia o su grupo \u00c3\u00a9tnico y con la forma en que usted se siente o reacciona a ello.",
        "DataType": "Integer",
        "ValueRange": "1 ; 2 ; 3 ; 4 ; 5",
        "Levels": {
            "1": "Strongly Agree Estoy totalmente de acuerdo",
            "2": "Agree Estoy  de acuerdo",
            "3": "Neutral Ni uno ni lo otro",
            "4": "Disagree No estoy de acuerdo",
            "5": "Strongly Disagree No estoy totalmente de acuerdo"
        }
    },
    "eventname": {
        "Description": "The event name for which the data was collected",
        "DataType": "String"
    },
    "meim_ethnic_id_p": {
        "Description": "In terms of ethnic group, I consider myself to be: \r\nEn cuanto a mi grupo \u00e9tnico, me considero: | 1 = White/Caucasian Blanco / Cauc\u00e1sico ; 2 = Western European Europeo occidental (del oeste) ; 3 = Eastern European Europeo oriental (del este) ; 4 = Hispanic/Latino Hispano / Latino ; 5 = Black/African American Negro / Afroamericano ; 6 = Afro-Carribean/Indo-Carribbean/West Indian (i.e. Jamaica; 7 = East Asian (i.e. China; 8 = South Asian (i.e. India; 9 = Southeast Asian (i.e. Phillipines; 10 = American Indian/Alaska Native Indio Americano / Nativo de Alaska ; 11 = Middle Eastern/North African De Medio Oriente / Norteafricano ; 12 = Native Hawaiian or Pacific Islander Nativo de Hawaii o Islas del Pac\u00edfico ; 13 = Mixed Ethnicity Etnicidad Mixta ; 14 = Other Ethnicity Otro origen \u00e9tnico ; 0 = None Ninguno ; 999 = Don't know No s\u00e9 ; 777 = Refuse to answer Me Niego a responder ",
        "DataType": "Integer",
        "ValueRange": "1 ; 2 ; 3 ; 4 ; 5 ; 6 ; 7 ; 8 ; 9 ; 10 ; 11 ; 12 ; 13 ; 14 ; 0 ; 999 ; 777",
        "Levels": {
            "1": "White/Caucasian Blanco / Cauc\u00e1sico",
            "2": "Western European Europeo occidental (del oeste)",
            "3": "Eastern European Europeo oriental (del este)",
            "4": "Hispanic/Latino Hispano / Latino",
            "5": "Black/African American Negro / Afroamericano",
            "6": "Afro-Carribean/Indo-Carribbean/West Indian (i.e. Jamaica",
            "7": "East Asian (i.e. China",
            "8": "South Asian (i.e. India",
            "9": "Southeast Asian (i.e. Phillipines",
            "10": "American Indian/Alaska Native Indio Americano / Nativo de Alaska",
            "11": "Middle Eastern/North African De Medio Oriente / Norteafricano",
            "12": "Native Hawaiian or Pacific Islander Nativo de Hawaii o Islas del Pac\u00edfico",
            "13": "Mixed Ethnicity Etnicidad Mixta",
            "14": "Other Ethnicity Otro origen \u00e9tnico",
            "0": "None Ninguno",
            "999": "Don't know No s\u00e9",
            "777": "Refuse to answer Me Niego a responder"
        }
    },
    "meim_1f_p": {
        "Description": "I have spent time trying to find out more about my ethnic group, such as its history, traditions, and customs. He pasado tiempo intentando saber mas sobre mi grupo etnico, como su historia, tradiciones y costumbres. | 5=Strongly Agree;  4=Agree; 3=Neutral ; 2=Disagree;  1=Strongly Disagree",
        "DataType": "Integer",
        "ValueRange": "1 ; 2 ; 3 ; 4 ; 5",
        "Levels": {
            "5": "Strongly Agree",
            "4": "Agree",
            "3": "Neutral",
            "2": "Disagree",
            "1": "Strongly Disagree"
        }
    },
    "meim_2f_p": {
        "Description": "I have a strong sense of belonging to my own ethnic group. Tengo un fuerte sentido de pertenecer con mi propio grupo etnico. | 5=Strongly Agree;  4=Agree; 3=Neutral ; 2=Disagree;  1=Strongly Disagree",
        "DataType": "Integer",
        "ValueRange": "1 ; 2 ; 3 ; 4 ; 5",
        "Levels": {
            "5": "Strongly Agree",
            "4": "Agree",
            "3": "Neutral",
            "2": "Disagree",
            "1": "Strongly Disagree"
        }
    },
    "meim_3f_p": {
        "Description": "I understand pretty well what my ethnic group membership means to me. Entiendo bastante bien lo que significa para m? pertenecer a mi grupo etnico. | 5=Strongly Agree;  4=Agree; 3=Neutral ; 2=Disagree;  1=Strongly Disagree",
        "DataType": "Integer",
        "ValueRange": "1 ; 2 ; 3 ; 4 ; 5",
        "Levels": {
            "5": "Strongly Agree",
            "4": "Agree",
            "3": "Neutral",
            "2": "Disagree",
            "1": "Strongly Disagree"
        }
    },
    "meim_4f_p": {
        "Description": "I have often done things that will help me understand my ethnic background better.Muchas veces he hecho cosas que me ayudar?n a comprender mejor a mi grupo etnico. | 5=Strongly Agree;  4=Agree; 3=Neutral ; 2=Disagree;  1=Strongly Disagree",
        "DataType": "Integer",
        "ValueRange": "1 ; 2 ; 3 ; 4 ; 5",
        "Levels": {
            "5": "Strongly Agree",
            "4": "Agree",
            "3": "Neutral",
            "2": "Disagree",
            "1": "Strongly Disagree"
        }
    },
    "meim_5f_p": {
        "Description": "I have often talked to other people in order to learn more about my ethnic group. Con frecuencia he hablado con otras personas para aprender mas sobre mi grupo etnico. | 5=Strongly Agree;  4=Agree; 3=Neutral ; 2=Disagree;  1=Strongly Disagree",
        "DataType": "Integer",
        "ValueRange": "1 ; 2 ; 3 ; 4 ; 5",
        "Levels": {
            "5": "Strongly Agree",
            "4": "Agree",
            "3": "Neutral",
            "2": "Disagree",
            "1": "Strongly Disagree"
        }
    },
    "meim_6f_p": {
        "Description": "I feel a strong attachment towards my own ethnic group.Siento una fuerte conexi?n hacia mi propio grupo etnico. | 5=Strongly Agree;  4=Agree; 3=Neutral ; 2=Disagree;  1=Strongly Disagree",
        "DataType": "Integer",
        "ValueRange": "1 ; 2 ; 3 ; 4 ; 5",
        "Levels": {
            "5": "Strongly Agree",
            "4": "Agree",
            "3": "Neutral",
            "2": "Disagree",
            "1": "Strongly Disagree"
        }
    }
}